[
  {
    "id": "8aa1e68",
    "elType": "container",
    "isInner": false,
    "settings": {
      "flex_direction": "column",
      "justify_content": "center",
      "align_items": "center",
      "gap": {
        "unit": "px",
        "size": 20
      },
      "padding": {
        "unit": "rem",
        "top": "6",
        "bottom": "6",
        "left": "2",
        "right": "2"
      },
      "background_background": "classic",
      "background_color": "#0B0F19",
      "border_border": "none",
      "border_color": "transparent",
      "border_radius": {
        "unit": "px",
        "size": 12
      },
      "border_bottom_width": "1px",
      "border_bottom_color": "rgba(99, 102, 241, 0.2)"
    },
    "elements": [
      {
        "id": "68235e3",
        "elType": "widget",
        "widgetType": "heading",
        "settings": {
          "title": "⚡ NEXT-GENERATION AUTONOMOUS AI FOR WORDPRESS",
          "header_size": "span",
          "align": "center",
          "title_color": "#818CF8",
          "typography_typography": "custom",
          "typography_font_size": {
            "unit": "px",
            "size": 14
          },
          "typography_font_weight": "700",
          "typography_letter_spacing": {
            "unit": "px",
            "size": 1.5
          }
        },
        "elements": []
      },
      {
        "id": "fb1a8e1",
        "elType": "widget",
        "widgetType": "heading",
        "settings": {
          "title": "Transform Ideas into WordPress Reality at the Speed of Thought",
          "header_size": "h1",
          "align": "center",
          "title_color": "#FFFFFF",
          "typography_typography": "custom",
          "typography_font_size": {
            "unit": "rem",
            "size": 3.5
          },
          "typography_font_weight": "800",
          "typography_line_height": {
            "unit": "em",
            "size": 1.15
          }
        },
        "elements": []
      },
      {
        "id": "4323463",
        "elType": "widget",
        "widgetType": "text-editor",
        "settings": {
          "editor": "<p style=\"text-align: center; color: #9CA3AF; font-size: 1.2rem; max-width: 780px; margin: 0 auto; line-height: 1.6;\">The ultimate autonomous AI platform with 86+ MCP tools, direct Elementor AST synthesis, and sub-15ms serverless edge intelligence. Build pixel-perfect sites in seconds.</p>"
        },
        "elements": []
      },
      {
        "id": "fcb1c12",
        "elType": "container",
        "isInner": false,
        "settings": {
          "flex_direction": "row",
          "justify_content": "center",
          "align_items": "center",
          "gap": {
            "unit": "px",
            "size": 16
          },
          "padding": {
            "unit": "rem",
            "top": "1.5",
            "bottom": "1.5",
            "left": "0",
            "right": "0"
          },
          "background_background": "transparent",
          "background_color": "transparent",
          "border_border": "none",
          "border_color": "transparent",
          "border_radius": {
            "unit": "px",
            "size": 12
          }
        },
        "elements": [
          {
            "id": "a6e58e1",
            "elType": "widget",
            "widgetType": "button",
            "settings": {
              "text": "🚀 Start Free 14-Day Trial",
              "align": "center",
              "button_type": "primary",
              "link": {
                "url": "#pricing"
              }
            },
            "elements": []
          },
          {
            "id": "2285648",
            "elType": "widget",
            "widgetType": "button",
            "settings": {
              "text": "📺 Watch 2-Min Live Demo",
              "align": "center",
              "button_type": "secondary",
              "link": {
                "url": "#features"
              }
            },
            "elements": []
          }
        ]
      },
      {
        "id": "c2c5d88",
        "elType": "widget",
        "widgetType": "image",
        "settings": {
          "image": {
            "url": "https://images.unsplash.com/photo-1618005182384-a83a8bd57fbe?auto=format&fit=crop&w=1200&q=80"
          },
          "align": "center",
          "caption": "Craftor Visual Web Studio & Elementor Live Canvas Bridge"
        },
        "elements": []
      }
    ]
  },
  {
    "id": "1ae53a5",
    "elType": "container",
    "isInner": false,
    "settings": {
      "flex_direction": "column",
      "justify_content": "flex-start",
      "align_items": "center",
      "gap": {
        "unit": "px",
        "size": 20
      },
      "padding": {
        "unit": "rem",
        "top": "5",
        "bottom": "5",
        "left": "2",
        "right": "2"
      },
      "background_background": "classic",
      "background_color": "#0F172A",
      "border_border": "none",
      "border_color": "transparent",
      "border_radius": {
        "unit": "px",
        "size": 12
      }
    },
    "elements": [
      {
        "id": "911cf93",
        "elType": "widget",
        "widgetType": "heading",
        "settings": {
          "title": "CORE CAPABILITIES",
          "header_size": "span",
          "align": "center",
          "title_color": "#38BDF8",
          "typography_font_size": {
            "unit": "px",
            "size": 13
          },
          "typography_font_weight": "700"
        },
        "elements": []
      },
      {
        "id": "4f31c8f",
        "elType": "widget",
        "widgetType": "heading",
        "settings": {
          "title": "Engineered for Autonomous WordPress Excellence",
          "header_size": "h2",
          "align": "center",
          "title_color": "#FFFFFF",
          "typography_font_size": {
            "unit": "rem",
            "size": 2.5
          }
        },
        "elements": []
      },
      {
        "id": "0db5068",
        "elType": "container",
        "isInner": false,
        "settings": {
          "flex_direction": "row",
          "justify_content": "space-between",
          "align_items": "stretch",
          "gap": {
            "unit": "px",
            "size": 24
          },
          "padding": {
            "unit": "rem",
            "top": "2",
            "bottom": "1",
            "left": "0",
            "right": "0"
          },
          "background_background": "transparent",
          "background_color": "transparent",
          "border_border": "none",
          "border_color": "transparent",
          "border_radius": {
            "unit": "px",
            "size": 12
          }
        },
        "elements": [
          {
            "id": "7ca1ee1",
            "elType": "container",
            "isInner": false,
            "settings": {
              "flex_direction": "column",
              "justify_content": "flex-start",
              "align_items": "stretch",
              "gap": {
                "unit": "px",
                "size": 20
              },
              "padding": {
                "unit": "rem",
                "top": "2",
                "bottom": "2",
                "left": "1.5",
                "right": "1.5"
              },
              "background_background": "classic",
              "background_color": "rgba(17, 24, 39, 0.7)",
              "border_border": "solid",
              "border_color": "rgba(75, 85, 99, 0.4)",
              "border_radius": {
                "unit": "px",
                "size": 12
              }
            },
            "elements": [
              {
                "id": "8089d36",
                "elType": "widget",
                "widgetType": "heading",
                "settings": {
                  "title": "✦ Direct Elementor AST Synthesis",
                  "header_size": "h3",
                  "title_color": "#F9FAFB",
                  "typography_font_size": {
                    "unit": "rem",
                    "size": 1.25
                  }
                },
                "elements": []
              },
              {
                "id": "69191d5",
                "elType": "widget",
                "widgetType": "text-editor",
                "settings": {
                  "editor": "<p style=\"color: #9CA3AF; line-height: 1.6; font-size: 0.95rem;\">Zero layout corruption. Generates native Flexbox and CSS Grid containers with typed properties and Global Kit variable bindings.</p>"
                },
                "elements": []
              }
            ]
          },
          {
            "id": "4ffd916",
            "elType": "container",
            "isInner": false,
            "settings": {
              "flex_direction": "column",
              "justify_content": "flex-start",
              "align_items": "stretch",
              "gap": {
                "unit": "px",
                "size": 20
              },
              "padding": {
                "unit": "rem",
                "top": "2",
                "bottom": "2",
                "left": "1.5",
                "right": "1.5"
              },
              "background_background": "classic",
              "background_color": "rgba(17, 24, 39, 0.7)",
              "border_border": "solid",
              "border_color": "rgba(75, 85, 99, 0.4)",
              "border_radius": {
                "unit": "px",
                "size": 12
              }
            },
            "elements": [
              {
                "id": "f8950e1",
                "elType": "widget",
                "widgetType": "heading",
                "settings": {
                  "title": "✦ 86+ Universal MCP Tools",
                  "header_size": "h3",
                  "title_color": "#F9FAFB",
                  "typography_font_size": {
                    "unit": "rem",
                    "size": 1.25
                  }
                },
                "elements": []
              },